664;=HYPERLINK("http://www.youtube.com/@andynofrizal","@andynofrizal");"2025-08-10T08:14:04Z";0;"Buat abang dan nona di luar sana dan gak menyinggung siapapun dan pihak manapun sedikit aja gua pengen utarakan biar paham aja dulu . miskin , menengah dan kaya itu pasti dan sudah terstruktur, ngomong tolol aja ya kalo yg miskin pada kaya siapa yg mau kerja, orang menengah gitu, kalo orang menengah pada kaya siapa yg mau kerja robot gitu? Kalo orang kaya kehabisan ilmu di permainkan robot gitu? Tinggal nunggu matinya doang jadi yg kek begituan udah ada jalannya masing masing gimana kita usahanya, usaha tidak pernah menghianati hasil, dan kehancuran akan ada pada orang itu sendiri yg ambil sikap dan keputusan begitupun juga kejayaan dan kebahagiaan, jadi gak usah menormalisasi kan omongan orang paham dulu struktur nya, gak ada marah gua juga nulis biasa aja nada rendah aja dan pikirkan dengan kepala dingin kata kata gua ( semua saling berhubungan dan menguntungkan jangan seolah olah lu lebih dari Tuhan)";=HYPERLINK("https://www.youtube.com/watch?v=fjDhHsKu6fQ&lc=UgwSyBBtyBRHAlCPoh94AaABAg","view source")
665;=HYPERLINK("http://www.youtube.com/@RicoArya-i5q","@RicoArya-i5q");"2025-08-10T07:32:02Z";0;"😹😹😹";=HYPERLINK("https://www.youtube.com/watch?v=fjDhHsKu6fQ&lc=Ugz3PuEpNp-r7jMcrFN4AaABAg","view source")
666;=HYPERLINK("http://www.youtube.com/@joninurekosaputro24","@joninurekosaputro24");"2025-08-10T06:20:11Z";0;"01:28 Serem juga";=HYPERLINK("https://www.youtube.com/watch?v=fjDhHsKu6fQ&lc=Ugx-Uc_vVSRUrR6fLtp4AaABAg","view source")
667;=HYPERLINK("http://www.youtube.com/@qwertyy-888","@qwertyy-888");"2025-08-10T04:48:32Z";0;"Timothy, denger ga lu?";=HYPERLINK("https://www.youtube.com/watch?v=fjDhHsKu6fQ&lc=UgwqCiZtjMSy6eLDr6h4AaABAg","view source")
668;=HYPERLINK("http://www.youtube.com/@Shufian_hezuru","@Shufian_hezuru");"2025-08-10T04:30:35Z";0;"Mantap bang😂😂";=HYPERLINK("https://www.youtube.com/watch?v=fjDhHsKu6fQ&lc=UgxyFnvM3msxy2gqpO94AaABAg","view source")
669;=HYPERLINK("http://www.youtube.com/@AinulYakin-e1h","@AinulYakin-e1h");"2025-08-10T03:18:44Z";0;"Thimoty blom pernah di kramasin parut klapa kayaknya";=HYPERLINK("https://www.youtube.com/watch?v=fjDhHsKu6fQ&lc=UgzfjCS10QrVqElbGip4AaABAg","view source")
670;=HYPERLINK("http://www.youtube.com/@chinthiaayudayana","@chinthiaayudayana");"2025-08-10T03:14:48Z";0;"timoti emg palkon sih";=HYPERLINK("https://www.youtube.com/watch?v=fjDhHsKu6fQ&lc=Ugw5y9xJpU4IKv9LOsl4AaABAg","view source")
671;=HYPERLINK("http://www.youtube.com/@aktrismistis","@aktrismistis");"2025-08-10T01:35:39Z";0;"Trauma gw nonton bloopers-nya 🤣🤣🤣🤣";=HYPERLINK("https://www.youtube.com/watch?v=fjDhHsKu6fQ&lc=UgyRYxE_4wjWrE_SfwF4AaABAg","view source")
672;=HYPERLINK("http://www.youtube.com/@aktrismistis","@aktrismistis");"2025-08-10T01:34:50Z";0;"Mr. Lobby Hotel 😂😂";=HYPERLINK("https://www.youtube.com/watch?v=fjDhHsKu6fQ&lc=UgywLqHeGmktxGMdktV4AaABAg","view source")
673;=HYPERLINK("http://www.youtube.com/@panjiarianto-z9k","@panjiarianto-z9k");"2025-08-09T21:50:37Z";0;"G semua orang malas miskin dan g semua orang kerja keras itu kaya..??? Orang miskin berpikir orang kaya sudah berbuat jadi usaha tanpa modal..???? Sperti kata motifator wkwkw akupun bisa cmn cakap";=HYPERLINK("https://www.youtube.com/watch?v=fjDhHsKu6fQ&lc=UgwJZxYWQCezyxVsnQV4AaABAg","view source")
674;=HYPERLINK("http://www.youtube.com/@syinahmad119","@syinahmad119");"2025-08-09T19:05:31Z";4;"Kalo emamg kaya karna kerja keras. Kuli bangunan pekerja lapangan adalah orang yang paling kaya.   Kalo kaya datang dari kepintaran guru guru para peneliti adalah yang paling kaya.   Dan kalo lu tanya orang sukses Kenapa bisa sukse dan kaya.?   Mereka juga gatau dan jawabanya basic. Kerja keras nabung dll.   Pada dasarnya kerja keras sabar dan ilmu adalah kunci menjalani kehidupan.   Soal kaya atau engga itu adalah kesempatan yang mungkin kita ga ambil karna suatu alasan.   Dan ketika kita ambil pun ada resikonya.";=HYPERLINK("https://www.youtube.com/watch?v=fjDhHsKu6fQ&lc=Ugwx0jmK1U3l7kgbJrJ4AaABAg","view source")
675;=HYPERLINK("http://www.youtube.com/@rivalz324","@rivalz324");"2025-12-16T02:24:53Z";0;"Se7";=HYPERLINK("https://www.youtube.com/watch?v=fjDhHsKu6fQ&lc=Ugwx0jmK1U3l7kgbJrJ4AaABAg.ALboGfCJ2aIAQmBId7izF0","view source")
676;=HYPERLINK("http://www.youtube.com/@MamanMadhadi","@MamanMadhadi");"2025-08-09T15:58:45Z";0;"Irul cocok klo pake jilbab 😝";=HYPERLINK("https://www.youtube.com/watch?v=fjDhHsKu6fQ&lc=UgyyOy4qncmXGeVwMKN4AaABAg","view source")
677;=HYPERLINK("http://www.youtube.com/@eddyjhonz8302","@eddyjhonz8302");"2025-08-09T13:31:35Z";0;"Hidup org itu beda2 dr nasib dan takdir..tdk bs kt ikutin org itu 100%..";=HYPERLINK("https://www.youtube.com/watch?v=fjDhHsKu6fQ&lc=UgyD65atgUgsOq-K6zF4AaABAg","view source")
678;=HYPERLINK("http://www.youtube.com/@felixabyan7644","@felixabyan7644");"2025-08-09T10:36:00Z";0;"Ketagihan vidio motivasi itu sama dgn masturbasi, kita adalah produk dari lingkungan dan circle dgn siapa kita bergaul dan berteman.";=HYPERLINK("https://www.youtube.com/watch?v=fjDhHsKu6fQ&lc=Ugz91thQm3tJDtKZyhd4AaABAg","view source")
679;=HYPERLINK("http://www.youtube.com/@rriiccetteeaamm","@rriiccetteeaamm");"2025-08-09T10:09:36Z";0;"timoti anjengggg";=HYPERLINK("https://www.youtube.com/watch?v=fjDhHsKu6fQ&lc=Ugzx9_o9TGlCMeqH9rR4AaABAg","view source")
680;=HYPERLINK("http://www.youtube.com/@YudiHartono66","@YudiHartono66");"2025-08-09T09:53:14Z";0;"jangan lupa join kelas y ges , pake kode promo";=HYPERLINK("https://www.youtube.com/watch?v=fjDhHsKu6fQ&lc=UgyEzRDcyb56fH4fyzJ4AaABAg","view source")
681;=HYPERLINK("http://www.youtube.com/@Movie100-y1q","@Movie100-y1q");"2025-08-09T09:24:11Z";0;"Gak ada yg lagi nge-gym bang..😅😅 lu kata2in juga harusnya orang gym bang..😅😅orang nonton bola juga..😅";=HYPERLINK("https://www.youtube.com/watch?v=fjDhHsKu6fQ&lc=UgwABZXYtNWguWMDWod4AaABAg","view source")
682;=HYPERLINK("http://www.youtube.com/@siskabae3","@siskabae3");"2025-08-09T09:18:27Z";0;"😂";=HYPERLINK("https://www.youtube.com/watch?v=fjDhHsKu6fQ&lc=UgzxtXxbR6RFFbt0Hc94AaABAg","view source")
683;=HYPERLINK("http://www.youtube.com/@azarians_universe","@azarians_universe");"2025-08-09T08:02:16Z";0;"setiap perkataan ada tanggung jawab didunia dan ahirat jangan merasa aman berkata kotor dan ngehina orang lain. rejeki itu sdh jalan takdir tuhan. menghina nasib adalah menghina takdir tuhan. drpd menghina kenapa tidak kalian bantu tuntaskan kemiskinan secara nyata kasih bantuan usaha dll drpd bacot ga berguna  #terutama untuk timoty dan sepesies sejenis";=HYPERLINK("https://www.youtube.com/watch?v=fjDhHsKu6fQ&lc=UgzK5hC2LhdegSHQ9yV4AaABAg","view source")
684;=HYPERLINK("http://www.youtube.com/@Jhon-wicx","@Jhon-wicx");"2025-08-09T07:22:23Z";0;"Tiboty ronald,,, maindset Tai 😂😂😂";=HYPERLINK("https://www.youtube.com/watch?v=fjDhHsKu6fQ&lc=UgyGuljHMIqvhI8Zuwl4AaABAg","view source")
685;=HYPERLINK("http://www.youtube.com/@clifforddittydotty175","@clifforddittydotty175");"2025-08-09T07:04:42Z";0;"Kenapa ya gen z salah mengambil panutan.. Timothy itu ilmunya belum terlalu luas. Jadi dia belum faham bagaimana kekuasaan bersinergi dengan para oligarky untuk membuat kebijakan yang menguntungkan mereka sendiri serta merugikan rakyat dan terjadilah kemiskinan secara structural..";=HYPERLINK("https://www.youtube.com/watch?v=fjDhHsKu6fQ&lc=Ugw8r-iTAn0AkuZk5Ix4AaABAg","view source")
686;=HYPERLINK("http://www.youtube.com/@jj-hi4re","@jj-hi4re");"2025-08-09T06:12:41Z";0;"butuh bamget konten gini, njir mewakili yg muak dengan konten timothy babi wkwk😂";=HYPERLINK("https://www.youtube.com/watch?v=fjDhHsKu6fQ&lc=UgyD-H14YXhee1yb5fp4AaABAg","view source")
687;=HYPERLINK("http://www.youtube.com/@firdaussimatupang6044","@firdaussimatupang6044");"2025-08-09T04:30:48Z";1;"Timothy Ronald ngerti kemiskinan struktural ga???";=HYPERLINK("https://www.youtube.com/watch?v=fjDhHsKu6fQ&lc=UgxEoX5vrpm_sZD58hZ4AaABAg","view source")
688;=HYPERLINK("http://www.youtube.com/@ekahamidhamid7514","@ekahamidhamid7514");"2025-08-09T03:49:55Z";0;"😂😂😂😂😂😂😂😂😂😂😂😂😂😂😂 t goblok";=HYPERLINK("https://www.youtube.com/watch?v=fjDhHsKu6fQ&lc=Ugw7EJPqWcayaRvLd_94AaABAg","view source")
689;=HYPERLINK("http://www.youtube.com/@CombroMisro-x4r","@CombroMisro-x4r");"2025-08-09T03:21:56Z";0;"gebleg lah maen slot tapi backsoundnya zuma😂 timothy ronal benar2 jd figur success boy muda";=HYPERLINK("https://www.youtube.com/watch?v=fjDhHsKu6fQ&lc=UgxnHrcBBGofQ_d81bR4AaABAg","view source")
690;=HYPERLINK("http://www.youtube.com/@AlamMatematik","@AlamMatematik");"2025-08-09T02:55:28Z";0;"Harusnya di ending si motivator itu pulang naik Beat Karbu tua bang, biar sesuai dengan penyembah-penyembahnya wkwk";=HYPERLINK("https://www.youtube.com/watch?v=fjDhHsKu6fQ&lc=Ugy_iDMvvrDC3SxRdGJ4AaABAg","view source")
691;=HYPERLINK("http://www.youtube.com/@kalumbuharsadi5743","@kalumbuharsadi5743");"2025-08-09T00:49:49Z";0;"Mudah bagi tuhan memeberi kita kekayaan,tapi tuhan tahu mana yang baik untuk hambanya, tugas kita hanya berusaha dan tawakal  Contoh Fir'aun itu orang kaya,tapi orang nya paling sombong, Kita aja kadang kadang lupa bersyukur ketika diberi nikmat";=HYPERLINK("https://www.youtube.com/watch?v=fjDhHsKu6fQ&lc=UgwqaMBIm3YxmSdoBJF4AaABAg","view source")
692;=HYPERLINK("http://www.youtube.com/@Katerdo","@Katerdo");"2025-08-08T17:28:37Z";0;"Gua miskin gua yang susah ngapain peduli kata orang bro😊 Selagi ga ngerugiin orang ya gpp,  Jangan kerja demi uang sampe sakit parah bro 😊";=HYPERLINK("https://www.youtube.com/watch?v=fjDhHsKu6fQ&lc=Ugylcz622hGT9gMnUBx4AaABAg","view source")
693;=HYPERLINK("http://www.youtube.com/@Everydayfootball10","@Everydayfootball10");"2025-08-08T13:25:45Z";0;"bibir atas tebelin biar lebih mirip";=HYPERLINK("https://www.youtube.com/watch?v=fjDhHsKu6fQ&lc=UgzxXAcoNg4bNX8McB54AaABAg","view source")
694;=HYPERLINK("http://www.youtube.com/@AnggiDwi-d4z","@AnggiDwi-d4z");"2025-08-08T13:14:36Z";0;"Keren sih kontennya.. Ngga usah perkataanya kotor dikeluarin apalagi ngejudge orang.. banyak faktor yg kita ngga ngerti kan tentang orang lain 😊";=HYPERLINK("https://www.youtube.com/watch?v=fjDhHsKu6fQ&lc=Ugz1r_ftl_CDqqjqpUB4AaABAg","view source")
695;=HYPERLINK("http://www.youtube.com/@customkaosbandung","@customkaosbandung");"2025-08-08T13:12:50Z";0;"Mantap";=HYPERLINK("https://www.youtube.com/watch?v=fjDhHsKu6fQ&lc=UgxwfG6DpddxSp0UqgB4AaABAg","view source")
696;=HYPERLINK("http://www.youtube.com/@ArioVanish","@ArioVanish");"2025-08-08T09:59:04Z";13;"Seorang anak yang terlahir dari keluarga miskin, tidak lantas ditakdirkan untuk selamanya miskin. Ia tetap memiliki kesempatan untuk belajar, bekerja keras, dan memperbaiki keadaan hidupnya. Jika ia berusaha dengan sungguh-sungguh, berdoa, dan bertawakal, Allah SWT akan memberikan kemudahan.";=HYPERLINK("https://www.youtube.com/watch?v=fjDhHsKu6fQ&lc=Ugz0QjvXXMPLqKrnLzV4AaABAg","view source")
697;=HYPERLINK("http://www.youtube.com/@musasigaming2039","@musasigaming2039");"2025-08-25T15:42:32Z";1;"lahir miskin,, lahir dipinggir jalan,, tangan cacat,, kaki cuma 1,, bisa jadi kayak C. Ronaldo ya bang?,,";=HYPERLINK("https://www.youtube.com/watch?v=fjDhHsKu6fQ&lc=Ugz0QjvXXMPLqKrnLzV4AaABAg.ALZFwT2GNMIAMFdl--Olo1","view source")
698;=HYPERLINK("http://www.youtube.com/@zetareticuli.","@zetareticuli.");"2025-08-08T09:45:02Z";0;"Ngegym itu ga ada gunanya 😂sekolah jg ga ada gunanya 😂lho keng ho juga ga guna kata si tukang plagiat";=HYPERLINK("https://www.youtube.com/watch?v=fjDhHsKu6fQ&lc=UgwTytpE60IbGvyYQRt4AaABAg","view source")
699;=HYPERLINK("http://www.youtube.com/@sryah5e","@sryah5e");"2025-08-08T09:04:18Z";0;"ORANG KEK GITU AJA BANYAK YG FOLLOWING.  DIA NGEBACOT KALO ADA YANG SETUJU MAKIN POPULER, KALO ADA YANG GAK SETUJU PUN MAKIN POPULER.  DIA BANYAK UANG ITU KARENA JADI INFLUENCER, BUKAN MURNI KARNA CRYPTO.  BISNIS DIA ITU DI MEDSOS, TERUS DIA INVESTASIINYA KE BITCOIN.";=HYPERLINK("https://www.youtube.com/watch?v=fjDhHsKu6fQ&lc=UgxQPVulH1X_MwOlyBZ4AaABAg","view source")
700;=HYPERLINK("http://www.youtube.com/@EdoKondomlegit","@EdoKondomlegit");"2025-08-08T08:47:18Z";0;"Makin hari makin sayang sama TARIKBOS ❤ Yang udah main di TARIKBOS pasti ngerti rasanya hoki asli!";=HYPERLINK("https://www.youtube.com/watch?v=fjDhHsKu6fQ&lc=UgyJJY6jwmSjEASEHL54AaABAg","view source")
701;=HYPERLINK("http://www.youtube.com/@tgk9437","@tgk9437");"2025-08-08T08:42:10Z";0;"Sunguh sangat relate. Ngomong selalu gampang. Coba duitmu sedekahkan semua jadi nol kembali, jika perlu smp minus atau hutsng bank, bagikan ke semua yg butuh, lalu kamu mulai lagi dari awal.";=HYPERLINK("https://www.youtube.com/watch?v=fjDhHsKu6fQ&lc=Ugwc5jC9YSxsGQ0PKjt4AaABAg","view source")
702;=HYPERLINK("http://www.youtube.com/@Portgas_D_Ace99","@Portgas_D_Ace99");"2025-08-08T08:39:45Z";0;"Lo kaya, miskin, sukses atau tidak keberuntungan tetap ikut andil disana. Lu denial = lu atheis walaupun kerja keras juga merupakan poin utamanya. Kalo semua sederhana hanya dengan modal kerja keras tanpa ada luck, di dunia ini seseorang seperti bill gates, mark Zuckerberg, dll bertebaran dimana-mana. Bahkan orang yg udah sukses pun ga bisa lari dari *LUCK* contoh kecil Gudang Garam yg saham nya makin anjlok dari yg 1 lot puluhan ribu sampe di bawah 10rb saat ini. Lu sombong, jangan lupa lu juga bisa terjun bebas";=HYPERLINK("https://www.youtube.com/watch?v=fjDhHsKu6fQ&lc=UgziiHZ6HO-pFGGOz5F4AaABAg","view source")
703;=HYPERLINK("http://www.youtube.com/@surya99-xxx","@surya99-xxx");"2025-08-08T07:38:00Z";0;"Bagaimana nasib yang tertipu sama si Timothy 😂😂😂";=HYPERLINK("https://www.youtube.com/watch?v=fjDhHsKu6fQ&lc=UgzVgsmeWupZBfOk2Zt4AaABAg","view source")
704;=HYPERLINK("http://www.youtube.com/@farahman","@farahman");"2025-08-08T03:46:14Z";0;"dialognya panjang juga";=HYPERLINK("https://www.youtube.com/watch?v=fjDhHsKu6fQ&lc=UgxytgXC0i_qQv6wZM14AaABAg","view source")
705;=HYPERLINK("http://www.youtube.com/@MainGosokanBom","@MainGosokanBom");"2025-08-07T23:26:05Z";0;"Temen gue lg demen2nya ngikutin Timothy Ronald.. Agak lain skrg";=HYPERLINK("https://www.youtube.com/watch?v=fjDhHsKu6fQ&lc=UgwPP33Z_p8HFbD4ixx4AaABAg","view source")
706;=HYPERLINK("http://www.youtube.com/@JulianDexter-k7u","@JulianDexter-k7u");"2025-08-07T23:15:46Z";0;"Timothy Timothy 😂😂😂";=HYPERLINK("https://www.youtube.com/watch?v=fjDhHsKu6fQ&lc=UgzylS9nH0yqtFyvvz54AaABAg","view source")
707;=HYPERLINK("http://www.youtube.com/@bandarbibit7","@bandarbibit7");"2025-08-07T17:52:10Z";0;"Sadar ngga kalo miskin itu kaya hati  Sedangkan kaya itu miskin hati  Itu lah kenyata,an  CONTOH  Orang miskin klo di dompet ada uang cuma 20 rb real ngasi 2 rb ke pengamen , sedangkan orang kaya di dompet 200 rb ngasi 2 rb ke pengamen ,, siapa yng kaya HATI ,,paham kan .😊😊😊😊😊😊😊😊😊";=HYPERLINK("https://www.youtube.com/watch?v=fjDhHsKu6fQ&lc=Ugxtgtuch8Ir-vbZ-9p4AaABAg","view source")
708;=HYPERLINK("http://www.youtube.com/@TanjungPutra-q3i","@TanjungPutra-q3i");"2025-08-07T17:14:46Z";0;"Bagian gym gw setuju ..emang banyak org goblok nya disana bukan krna sok tau atau mendukung dia tpi fakta nya emang begitu cuman 3% di gym yg nge cari buat kebugaran tubuh dan bentuk ideal mereka sisa nya yaa cuman pamer nge humu nge steroid banyak lagi 😂";=HYPERLINK("https://www.youtube.com/watch?v=fjDhHsKu6fQ&lc=Ugxaasqs2llORePXRVB4AaABAg","view source")
709;=HYPERLINK("http://www.youtube.com/@rintokun24","@rintokun24");"2025-08-07T16:25:22Z";0;"Bjir oaksoalaoa candy crush 😂";=HYPERLINK("https://www.youtube.com/watch?v=fjDhHsKu6fQ&lc=Ugzyv3R3wxG03waooIB4AaABAg","view source")
710;=HYPERLINK("http://www.youtube.com/@Faithhope20","@Faithhope20");"2025-08-07T16:03:45Z";0;"Some people are poor, because the only thing they had only money";=HYPERLINK("https://www.youtube.com/watch?v=fjDhHsKu6fQ&lc=UgwNr9QmSZGdvGVqxTF4AaABAg","view source")
711;=HYPERLINK("http://www.youtube.com/@Inosuke-n6g","@Inosuke-n6g");"2025-08-07T14:36:16Z";0;"Maklum aja NPD dia😅";=HYPERLINK("https://www.youtube.com/watch?v=fjDhHsKu6fQ&lc=UgzJFDT0bINa0s9LX3R4AaABAg","view source")
712;=HYPERLINK("http://www.youtube.com/@laukpauk8868","@laukpauk8868");"2025-08-07T12:20:47Z";0;"1:28 😂😂😂😂...kok bisa masuk konten 'kamu di atas ya? "" 😂";=HYPERLINK("https://www.youtube.com/watch?v=fjDhHsKu6fQ&lc=Ugz3UcLNnpz4sxsQ95J4AaABAg","view source")
713;=HYPERLINK("http://www.youtube.com/@audiraozawa","@audiraozawa");"2025-08-07T11:36:53Z";5;"Hidup itu berputar, kadang diatas, kadang diatas bgt 😊";=HYPERLINK("https://www.youtube.com/watch?v=fjDhHsKu6fQ&lc=UgzwN8yZck2L086U3b14AaABAg","view source")
714;=HYPERLINK("http://www.youtube.com/@laukpauk8868","@laukpauk8868");"2025-08-07T12:23:59Z";1;"Lebih ke spiral ❤😂";=HYPERLINK("https://www.youtube.com/watch?v=fjDhHsKu6fQ&lc=UgzwN8yZck2L086U3b14AaABAg.ALWrL-A1F-jALWwj-nNAaq","view source")
715;=HYPERLINK("http://www.youtube.com/@MustiBisa-b7e","@MustiBisa-b7e");"2025-08-07T09:45:36Z";3;"W suka sama ektinya ponco totalitas banget😅";=HYPERLINK("https://www.youtube.com/watch?v=fjDhHsKu6fQ&lc=UgzlkqRb4uFzFmzJ--B4AaABAg","view source")
716;=HYPERLINK("http://www.youtube.com/@wetoday5279","@wetoday5279");"2025-08-07T08:49:49Z";0;"Kena mental 😂";=HYPERLINK("https://www.youtube.com/watch?v=fjDhHsKu6fQ&lc=UgzYzYKAHx3irM5itXR4AaABAg","view source")
717;=HYPERLINK("http://www.youtube.com/@FaktaKecil-l7b","@FaktaKecil-l7b");"2025-08-07T08:17:09Z";0;"Arogan😂";=HYPERLINK("https://www.youtube.com/watch?v=fjDhHsKu6fQ&lc=UgyA0bHQ5tPnSTLd41V4AaABAg","view source")
718;=HYPERLINK("http://www.youtube.com/@Cekukuk202Cekukuk","@Cekukuk202Cekukuk");"2025-08-07T08:03:54Z";2;"Lu miskin lu gblk = main kripto secara solo. Masuk akademinya itupun jga bnyak yg rungkada wkwowk";=HYPERLINK("https://www.youtube.com/watch?v=fjDhHsKu6fQ&lc=UgwKRXsk_6c76G4I2up4AaABAg","view source")
719;=HYPERLINK("http://www.youtube.com/@masdktok","@masdktok");"2025-08-07T07:18:29Z";0;"TR tu mau viral biar klasnya laku gtu aja cri uang nya dngn kontrovarsi mkanya dia cerdas bngt ug kagum ma kecerdasan nya";=HYPERLINK("https://www.youtube.com/watch?v=fjDhHsKu6fQ&lc=UgzmNr6dDkXC0oUJhyl4AaABAg","view source")
720;=HYPERLINK("http://www.youtube.com/@Sagaraathalla","@Sagaraathalla");"2025-08-07T06:06:57Z";0;"Gw besar di desa, orang desa bangun pagi jam 4, bahkan ada yg jam 3 buat nyiapin dagangannya, mikul dagangannya buat dibawa ke pasar, udah melebihi kedisiplinan EL PERINTIS, tapi hidupnya seperti itu saja nggak kaya2, apa mereka bodoh? Menurut gw orang pintar masih kalah sama orang bijak, dan orang sok pintar ky Timoti Ronal itu lebih bodoh dari orang dungu";=HYPERLINK("https://www.youtube.com/watch?v=fjDhHsKu6fQ&lc=UgxW1T_9gzXRb4bD21V4AaABAg","view source")
721;=HYPERLINK("http://www.youtube.com/@failasufam2666","@failasufam2666");"2025-08-07T06:00:43Z";0;"hhhahhahhaa";=HYPERLINK("https://www.youtube.com/watch?v=fjDhHsKu6fQ&lc=UgyzXyjlw_0lTOi1n-B4AaABAg","view source")
722;=HYPERLINK("http://www.youtube.com/@GratefulMoslem","@GratefulMoslem");"2025-08-07T05:55:45Z";0;"miskin juga bisa bahagia kaya juga bisa sengsara semua itu di dalam hati";=HYPERLINK("https://www.youtube.com/watch?v=fjDhHsKu6fQ&lc=UgznCGuIFPoz5C6yQgV4AaABAg","view source")
723;=HYPERLINK("http://www.youtube.com/@asepfahruljaelani9566","@asepfahruljaelani9566");"2025-08-07T05:25:16Z";0;"Enggak semua orang miskin itu malas...banyak yang miskin karena keadaan keluarga atau emang dimiskinkan negara....jangan mentang-mentang sukses dan kaya elu jadi Belagu dan enggak punya Akhlak";=HYPERLINK("https://www.youtube.com/watch?v=fjDhHsKu6fQ&lc=UgwqL8cwQdBo7PB_2KJ4AaABAg","view source")
724;=HYPERLINK("http://www.youtube.com/@bangwayan6226","@bangwayan6226");"2025-08-07T05:11:11Z";0;"Kejahatan yang dilakuin ORANG MISKIN itu MELAHIRKAN BANYAK ANAK";=HYPERLINK("https://www.youtube.com/watch?v=fjDhHsKu6fQ&lc=UgwYz3IsCqeKmzWeTw14AaABAg","view source")
725;=HYPERLINK("http://www.youtube.com/@Rezpita7","@Rezpita7");"2025-08-07T05:10:49Z";0;"Ngakak";=HYPERLINK("https://www.youtube.com/watch?v=fjDhHsKu6fQ&lc=UgzUe4XEXGxKXrzV_054AaABAg","view source")
726;=HYPERLINK("http://www.youtube.com/@arsyilaadventure3865","@arsyilaadventure3865");"2025-08-07T03:19:16Z";1;"Gag usah baper, Mustinya bikin cambuk buat maju, belajar & gag malas.  Malah dibikin cari duit lewat parodi komedi.😂";=HYPERLINK("https://www.youtube.com/watch?v=fjDhHsKu6fQ&lc=UgzIeWOsxRO4kgsIsVt4AaABAg","view source")
727;=HYPERLINK("http://www.youtube.com/@rezadroidjr","@rezadroidjr");"2025-08-09T05:20:43Z";0;"Nah ini salah satu contohnya 💀";=HYPERLINK("https://www.youtube.com/watch?v=fjDhHsKu6fQ&lc=UgzIeWOsxRO4kgsIsVt4AaABAg.ALVyON8klHHALaKsfcOFy0","view source")
728;=HYPERLINK("http://www.youtube.com/@reinhartzey999","@reinhartzey999");"2025-08-07T02:29:19Z";0;"Pengen sih gw dengar kabar og2 model timoty jatuh mskin bangkrut ludes hartanya..masih bs gak ngebacot😅😅😅";=HYPERLINK("https://www.youtube.com/watch?v=fjDhHsKu6fQ&lc=UgzHQKYEaqiKNcM3Fb94AaABAg","view source")
729;=HYPERLINK("http://www.youtube.com/@Senkusan-mp","@Senkusan-mp");"2025-08-07T01:39:43Z";0;"Keren sih videonya";=HYPERLINK("https://www.youtube.com/watch?v=fjDhHsKu6fQ&lc=UgxTvopA7Mo6dN6hiVF4AaABAg","view source")
730;=HYPERLINK("http://www.youtube.com/@mfaisalal9050","@mfaisalal9050");"2025-08-07T00:35:38Z";0;"Timothy itu indra kenz jenis yang baru wkwk";=HYPERLINK("https://www.youtube.com/watch?v=fjDhHsKu6fQ&lc=UgyvF1iZqoExftDt8MV4AaABAg","view source")
731;=HYPERLINK("http://www.youtube.com/@kefas25","@kefas25");"2025-08-07T00:10:46Z";2;"Timothy kontol 😂";=HYPERLINK("https://www.youtube.com/watch?v=fjDhHsKu6fQ&lc=UgxeStQQMWVEHLWQ4-R4AaABAg","view source")
732;=HYPERLINK("http://www.youtube.com/@Ceriaaaaa","@Ceriaaaaa");"2025-08-06T20:37:11Z";0;"Hahahahahaha bener pula 😂 ngakak😂";=HYPERLINK("https://www.youtube.com/watch?v=fjDhHsKu6fQ&lc=UgzIlVSF1sOmjj_awyt4AaABAg","view source")
733;=HYPERLINK("http://www.youtube.com/@HapeKu-du4id","@HapeKu-du4id");"2025-08-06T12:55:09Z";0;"Andrew tate copy paste 😂😂😂😂";=HYPERLINK("https://www.youtube.com/watch?v=fjDhHsKu6fQ&lc=UgzkVYRok6wqfPf95VB4AaABAg","view source")
734;=HYPERLINK("http://www.youtube.com/@HapeKu-du4id","@HapeKu-du4id");"2025-08-06T12:55:09Z";0;"Andrew tate copy paste 😂😂😂😂";=HYPERLINK("https://www.youtube.com/watch?v=fjDhHsKu6fQ&lc=Ugyvq25CvJkjBcgPWDZ4AaABAg","view source")
735;=HYPERLINK("http://www.youtube.com/@RaditSofwan","@RaditSofwan");"2025-08-06T09:48:48Z";0;"Nggak kebayang gw kalo timoty jadi orang miskin dia ngemis apa cuman nyocot doang";=HYPERLINK("https://www.youtube.com/watch?v=fjDhHsKu6fQ&lc=Ugw1ZrSQS9FpItZDxHR4AaABAg","view source")
736;=HYPERLINK("http://www.youtube.com/@JambanTay","@JambanTay");"2025-08-06T09:30:43Z";0;"dopamin";=HYPERLINK("https://www.youtube.com/watch?v=fjDhHsKu6fQ&lc=Ugx36l_4nzgH1DHg9Qh4AaABAg","view source")
737;=HYPERLINK("http://www.youtube.com/@AldiSomba","@AldiSomba");"2025-08-06T09:19:19Z";0;"tapi kan bang di situ letak asiknya";=HYPERLINK("https://www.youtube.com/watch?v=fjDhHsKu6fQ&lc=Ugzz-dlf7WIxfNb_XzZ4AaABAg","view source")
738;=HYPERLINK("http://www.youtube.com/@FishMarketIndonesia","@FishMarketIndonesia");"2025-08-06T08:49:55Z";0;"Pokoknya yg gak main Crypto itu Goblok, Miskin, Males Iya kan? Bang Timothy Ronald???";=HYPERLINK("https://www.youtube.com/watch?v=fjDhHsKu6fQ&lc=Ugy_AOuVoN4zvS-cer54AaABAg","view source")
739;=HYPERLINK("http://www.youtube.com/@EdoKondomlegit-w7j9r","@EdoKondomlegit-w7j9r");"2025-08-06T07:52:04Z";0;"TARIKBOS itu tempatnya sultan beneran, bukan gimmick! Baru nonton 5 menit, tapi saldo dari TARIKBOS udah masuk!";=HYPERLINK("https://www.youtube.com/watch?v=fjDhHsKu6fQ&lc=Ugxm2H1AvZx4zMCdPzV4AaABAg","view source")
740;=HYPERLINK("http://www.youtube.com/@allanpoe6213","@allanpoe6213");"2025-08-06T06:32:03Z";1;"sumpah bro semua kata2nya bener2 copas andrew tate jir, literally jiplak terus translate ke indonesia holy molly";=HYPERLINK("https://www.youtube.com/watch?v=fjDhHsKu6fQ&lc=UgwrbTWHlQyEJIhkZ0d4AaABAg","view source")
741;=HYPERLINK("http://www.youtube.com/@mebelindonesia","@mebelindonesia");"2025-08-06T04:48:47Z";1;"wkwkwk";=HYPERLINK("https://www.youtube.com/watch?v=fjDhHsKu6fQ&lc=UgyrNf4bY9Lq72e5aKR4AaABAg","view source")
742;=HYPERLINK("http://www.youtube.com/@rysaitama6833","@rysaitama6833");"2025-08-06T03:59:51Z";1;"Ponco emang paling cocok jadi,brandal wkwkw 😂";=HYPERLINK("https://www.youtube.com/watch?v=fjDhHsKu6fQ&lc=UgwXBdpFds9NCwFMf7F4AaABAg","view source")
743;=HYPERLINK("http://www.youtube.com/@Nikmati123","@Nikmati123");"2025-08-06T03:39:15Z";1;"Timoty bacot wkwkw";=HYPERLINK("https://www.youtube.com/watch?v=fjDhHsKu6fQ&lc=UgwWYDCM61PqoY8asJh4AaABAg","view source")
744;=HYPERLINK("http://www.youtube.com/@rinipermadi9975","@rinipermadi9975");"2025-08-06T02:52:21Z";3;"Minimal tidak jadi beban orang lain.  Syukur syukur bisa manfaat buat orang banyak.";=HYPERLINK("https://www.youtube.com/watch?v=fjDhHsKu6fQ&lc=UgxzroH3sypUQoC7EB54AaABAg","view source")
745;=HYPERLINK("http://www.youtube.com/@REALMAGER7","@REALMAGER7");"2025-08-06T02:34:37Z";1;"Sultan bitcoin bnyk bcot";=HYPERLINK("https://www.youtube.com/watch?v=fjDhHsKu6fQ&lc=Ugxayp9nhzgTa6ZjrPt4AaABAg","view source")
746;=HYPERLINK("http://www.youtube.com/@muthmainnahmarsum5046","@muthmainnahmarsum5046");"2025-08-06T01:57:46Z";6;"Org² yg merasa kaya dan meremehkan org lain, mgkn blm ada apa²nya dg qarun, yg cerdas tapi sombong dg kekayaannya.  Pada akhirnya ditenggelamkan jg.  Kita butuh berhati² dalam bersikap. Krn kekayaan kita tdk ada gunanya klo hidup kita tdk bermanfaat utk org lain. Yg ada tinggal nama doang.";=HYPERLINK("https://www.youtube.com/watch?v=fjDhHsKu6fQ&lc=UgwLVuiZ_bBqoq-HHZl4AaABAg","view source")
