1304;=HYPERLINK("http://www.youtube.com/@Beruang.Laut85","@Beruang.Laut85");"2025-07-29T08:49:03Z";3;"Menurut gw influencer2 yg kerja nya pamer2 duit begini uangnya bukan dari pengikutnya..   Tapi justru dari pihak2 yg pengen di cuci uangnya melalui mereka..   Karena selalu mencitrakan diri kaya, maka org ga bakal ada yg mempertanyakan kekayaan dia itu dari mana.. Yg penting bayar pajak..   Di situ lah org2 yg punya uang kotor pake jasa dia utk tempat pencucian uang..  Makanya kalo liat2 circlenya kan keliatan tuh..   Bukan cuman si timoti ini.. Liat aja influencer lain yg tau2 mendadak tajir mampus tanpa penjelasan..";=HYPERLINK("https://www.youtube.com/watch?v=fjDhHsKu6fQ&lc=UgxZV1cK6RTAcqIa7fN4AaABAg.AL8hSPDrkH_AL9Nyvezs56","view source")
1305;=HYPERLINK("http://www.youtube.com/@Dropout_str","@Dropout_str");"2025-07-29T11:39:38Z";2;"Betul, yg duitnya dpt trading justru kalimasada. Holder shiba inu jaman batu, hoki 17jt % kenaikan.";=HYPERLINK("https://www.youtube.com/watch?v=fjDhHsKu6fQ&lc=UgxZV1cK6RTAcqIa7fN4AaABAg.AL8hSPDrkH_AL9gVGKcGXe","view source")
1306;=HYPERLINK("http://www.youtube.com/@humpimpah9917","@humpimpah9917");"2025-07-29T13:41:34Z";0;"Bener banget lagi";=HYPERLINK("https://www.youtube.com/watch?v=fjDhHsKu6fQ&lc=UgxZV1cK6RTAcqIa7fN4AaABAg.AL8hSPDrkH_AL9uSO7BmwF","view source")
1307;=HYPERLINK("http://www.youtube.com/@Hendry-l2m","@Hendry-l2m");"2025-08-28T08:50:43Z";0;"Bro berfikir Timothy cuma invest di crypto, saham dia naik ribuan persen jdi gk cuma crypto doang";=HYPERLINK("https://www.youtube.com/watch?v=fjDhHsKu6fQ&lc=UgxZV1cK6RTAcqIa7fN4AaABAg.AL8hSPDrkH_AMMd0Li81r4","view source")
1308;=HYPERLINK("http://www.youtube.com/@supriyanto4405","@supriyanto4405");"2025-07-29T02:17:42Z";35;"Kemiskinan tidak melulu disebabkan oleh  perilaku suatu individu yang tidak produktif ( seperti sifat malas, berkemauan lemah, apatis berkesinambungan ).Tapi kemiskinan juga bisa disetting atau diciptakan oleh sistem.Contoh pemerintahan suatu negara bisa memprogram pemiskinan & kebodohan warga negaranya, maksudnya suatu pemerintahan negara sengaja' membiarkan kebodohan & kemiskinan warganya agar mudah dikendalikan.Dalam cakupan yang lebih luas lagi , sebuah negara super power bisa memiskinkan negara negara berkembang.Contoh : Amerika Serikat memiskinkan suatu negara berkembang dengan sistem bernama kapitalisme, ribawi .Dan dalam cakupan yang lebih luas lagi ; dinasti konsorsium multinasional mampu memiskinkan banyak negara melalui monopoli perdagangan dan bisnis yang menggurita dalam bingkai kapitalisme Internasional.Contoh ; Rockefeller dan Rothschild kedua dinasti ini mampu memiskinkan banyak sekali negara, menyingkirkan saingan bisnis dengan sangat mudah.Mereka layaknya monster yang mengendalikan dunia ini di balik layar , dengan kontrol yang sangat kuat di berbagai bidang.";=HYPERLINK("https://www.youtube.com/watch?v=fjDhHsKu6fQ&lc=UgzfouWiu_QWcRP7tUV4AaABAg","view source")
1309;=HYPERLINK("http://www.youtube.com/@ErenYeager-c6g4v","@ErenYeager-c6g4v");"2025-11-20T09:02:23Z";0;"Intinya Lingkungan berperan penting pada cara berpikir seseorang";=HYPERLINK("https://www.youtube.com/watch?v=fjDhHsKu6fQ&lc=UgzfouWiu_QWcRP7tUV4AaABAg.AL8gBXBQd5fAPjx7IZson_","view source")
1310;=HYPERLINK("http://www.youtube.com/@widodoakrom3938","@widodoakrom3938");"2025-11-28T08:47:44Z";1;"True";=HYPERLINK("https://www.youtube.com/watch?v=fjDhHsKu6fQ&lc=UgzfouWiu_QWcRP7tUV4AaABAg.AL8gBXBQd5fAQ3Wo3Dlavz","view source")
1311;=HYPERLINK("http://www.youtube.com/@TepanGaming1617","@TepanGaming1617");"2025-07-29T02:05:57Z";1;"Anjeng😂😂😂";=HYPERLINK("https://www.youtube.com/watch?v=fjDhHsKu6fQ&lc=UgyCCdP6YiiPNK4fgjx4AaABAg","view source")
1312;=HYPERLINK("http://www.youtube.com/@RizkiAbdulRajak","@RizkiAbdulRajak");"2025-07-29T01:57:33Z";0;"1:21 ""banyak anak banyak rezeki""   ~ bokap gue 2022";=HYPERLINK("https://www.youtube.com/watch?v=fjDhHsKu6fQ&lc=UgxGAab55xC-ub2hl1B4AaABAg","view source")
1313;=HYPERLINK("http://www.youtube.com/@DewaMaulana-g3x","@DewaMaulana-g3x");"2025-07-29T01:36:40Z";1;"Berjuang dari kaya masih juga ada yg gagal. Apalagi berjuang dari minus coy, malah di katain arogan.😂";=HYPERLINK("https://www.youtube.com/watch?v=fjDhHsKu6fQ&lc=Ugw5i1BFxO9O9VZ2Kp14AaABAg","view source")
1314;=HYPERLINK("http://www.youtube.com/@adelpuspita5508","@adelpuspita5508");"2025-07-29T01:20:20Z";0;"Kalo apa yg semua timothy blg bner ga akan ada lagi namanya karyawan dalam hidup ini,semua jadi bos..titik.. Kalo kata gua bnyak bacot si timothy itu,,kebanyakan bacot dgn kata logika si timothy itu 😅😂";=HYPERLINK("https://www.youtube.com/watch?v=fjDhHsKu6fQ&lc=UgxPi5Pv2_1o9eaC0Dp4AaABAg","view source")
1315;=HYPERLINK("http://www.youtube.com/@ikanpredator4555","@ikanpredator4555");"2025-07-29T01:19:44Z";0;"Motivator ilusi...  Pinter ngebacot timoty";=HYPERLINK("https://www.youtube.com/watch?v=fjDhHsKu6fQ&lc=UgyuPXBxY1ITJKVOR0d4AaABAg","view source")
1316;=HYPERLINK("http://www.youtube.com/@lovezwijaya8947","@lovezwijaya8947");"2025-07-29T01:17:19Z";0;"Memperkaya Timothy 😂";=HYPERLINK("https://www.youtube.com/watch?v=fjDhHsKu6fQ&lc=UgwB14CG03vC7xMbrlt4AaABAg","view source")
1317;=HYPERLINK("http://www.youtube.com/@afshinmubarok999","@afshinmubarok999");"2025-07-29T01:02:13Z";0;"Itulah letak tata serunya 😂😂";=HYPERLINK("https://www.youtube.com/watch?v=fjDhHsKu6fQ&lc=Ugwx4jrrL41yA1KGkUJ4AaABAg","view source")
1318;=HYPERLINK("http://www.youtube.com/@ahmatfaizal6681","@ahmatfaizal6681");"2025-07-29T01:00:10Z";0;"Kalo gw si percaya sama omongan Abang gw kalo lu akar mati tu bergaul nya sama pohon yg hdp biar lu BS jadi pohon yg subur Janggan lu akar mati ketemu sama akar mati ya lu nga BS hdp BKN soal pilih"" pergaulan tp ada bener ny jg hdp sama orng yg ngada pikiran buat maju ya lu di situ"" aja tp beda sama orng yg berfikiran untuk maju lu pasti ikutan maju entah di bawa atau lu jadi BS mikir buat maju";=HYPERLINK("https://www.youtube.com/watch?v=fjDhHsKu6fQ&lc=UgxtIL_9TatHmDWCX4R4AaABAg","view source")
1319;=HYPERLINK("http://www.youtube.com/@AlgoNudger","@AlgoNudger");"2025-07-29T00:56:49Z";6;"Sebagian ada yang gue setuju dan tidak gue setuju dari pendapat dan gaya Timothy, tapi pada dasarnya, mayoritas (jika tidak ingin dikatakan seluruh) para penghuni konoha memang merupakan kumpulan para pemalas (dalam hal *memaksimalkan penggunaan otak,* bukan fisik), contohnya, ketika mereka merasa bahwa urusan perut dan bawah perut mereka sudah terpenuhi secara ""stabil"" (tidak harus kaya raya, cukup sekedar bisa hidup ""sederhana"", seperti: bisa makan 3x sehari, kredit KPR bersubsidi, menyekolahkan anak di sekolah negeri bersubsidi, punya motor/LCGC, liburan sebulan sekali pun, sudah cukup bagi mereka).  Maka, di saat itu pula, secara otomatis mereka pun akan *langsung menonaktifkan fungsi otak mereka hingga akhir hayatnya,* lalu mulailah mereka ""menikmati"" gaya hidup malas dengan dalih 'slow living', *padahal gaya hidup repetitif tanpa perkembangan daya pikir.* Prinsip hidup seperti inilah yang terus menerus mereka wariskan dari masa ke masa, secara turun temurun dari generasi ke generasi. Mereka seringkali menyebut prinsip hidup seperti ini dengan istilah *'HIDUP REALISTIS'.*  Oleh sebab itulah tidak mengherankan jika bangsa konoha semakin tertinggal dan terbelakang dari zaman ke zaman oleh bangsa lain, terutama dalam bidang sains dan teknologi. Lalu, ketika terjadi sebuah peristiwa seperti di konoha sendiri atau di Gaza, maka, pihak yang paling mereka salahkan adalah pihak yang menzalimi (playing victim?), bukannya malah introspeksi diri, dengan bertanya, apakah penyebab sebenarnya sehingga mereka bisa terus menjadi pihak yang dizalimi (kemalasan berpikirkah?). 🤭";=HYPERLINK("https://www.youtube.com/watch?v=fjDhHsKu6fQ&lc=Ugy6UYueo0CiJSttb814AaABAg","view source")
1320;=HYPERLINK("http://www.youtube.com/@aaronspark328","@aaronspark328");"2025-07-29T04:57:46Z";0;"Tulisan paling bermutu. 👍";=HYPERLINK("https://www.youtube.com/watch?v=fjDhHsKu6fQ&lc=Ugy6UYueo0CiJSttb814AaABAg.AL8Xw8UIVJfAL8yVztvGAn","view source")
1321;=HYPERLINK("http://www.youtube.com/@AlgoNudger","@AlgoNudger");"2025-07-29T06:00:36Z";0;"​@aaronspark328Just tryna spit some harsh truths, Bud! 🙇";=HYPERLINK("https://www.youtube.com/watch?v=fjDhHsKu6fQ&lc=Ugy6UYueo0CiJSttb814AaABAg.AL8Xw8UIVJfAL94hALueiJ","view source")
1322;=HYPERLINK("http://www.youtube.com/@Husni9T","@Husni9T");"2025-07-29T07:34:43Z";0;"​@AlgoNudgerIni coment yang paling manuk akal mas saluttt";=HYPERLINK("https://www.youtube.com/watch?v=fjDhHsKu6fQ&lc=Ugy6UYueo0CiJSttb814AaABAg.AL8Xw8UIVJfAL9FTX4zHlp","view source")
1323;=HYPERLINK("http://www.youtube.com/@zyynnn500","@zyynnn500");"2025-07-29T10:09:42Z";0;"Nah ini komen yang paling make sense mas";=HYPERLINK("https://www.youtube.com/watch?v=fjDhHsKu6fQ&lc=Ugy6UYueo0CiJSttb814AaABAg.AL8Xw8UIVJfAL9XCY0TJ4m","view source")
1324;=HYPERLINK("http://www.youtube.com/@AlgoNudger","@AlgoNudger");"2025-07-29T10:16:01Z";0;"Thx, Bud! 🙇";=HYPERLINK("https://www.youtube.com/watch?v=fjDhHsKu6fQ&lc=Ugy6UYueo0CiJSttb814AaABAg.AL8Xw8UIVJfAL9XvrVWka6","view source")
1325;=HYPERLINK("http://www.youtube.com/@AlgoNudger","@AlgoNudger");"2025-07-29T10:17:40Z";0;"Thx! 🙇";=HYPERLINK("https://www.youtube.com/watch?v=fjDhHsKu6fQ&lc=Ugy6UYueo0CiJSttb814AaABAg.AL8Xw8UIVJfAL9Y6tcJVN5","view source")
1326;=HYPERLINK("http://www.youtube.com/@Dropout_str","@Dropout_str");"2025-07-29T12:04:08Z";2;"Inikan kita lagi ngomongin org susah/miskin yah. Hidup sederhana, makan 3x sehari, krdit kpr bersubsidi, punya motor, liburan sebulan sekali.  Ini bukan cukup, udh lebih2 bang bagi org yg skrg lagi susah / miskin, makan 3x sehari ga ngutang itu udh capaian harian yg cukup berat bagi sebagian org, aplgi motor, liburan sebulan sekali Ya ampun bang inimah puncak-nya mereka. Wajar aja ketika org start dari miskin ke sederhana model begini mereka mengaktifkan slow living krna ini udh setengah modar ngejarnya.  Terus kita yg hidup start dari sederhana, yg makan udh ada, motor punya, rumah ada, sekolah bisa, kuliah bisa, ngomong ""bahwa org2 seperti mereka yg slow living ketika merasa cukup terpenuhi menikmati kesederhana yg merka dambakan yg buat kemunduran bangsa"" broo tolonglah, sudah ga semua org ada dilevel yg sama, apa yg kita punya itu mimpi besar bagi sebagian org";=HYPERLINK("https://www.youtube.com/watch?v=fjDhHsKu6fQ&lc=Ugy6UYueo0CiJSttb814AaABAg.AL8Xw8UIVJfAL9jIicz0cw","view source")
1327;=HYPERLINK("http://www.youtube.com/@AlgoNudger","@AlgoNudger");"2025-07-29T13:21:00Z";0;"@Dropout. Sebenernya, gak salah juga sih klo kalian ingin tetap punya dan mempertahankan prinsip *'HIDUP REALISTIS'* model begituan, karena hidup ini adalah pilihan masing-masing.  Tapi, gak usah ngeluh dan merasa terzalimi (playing victim) juga, klo suatu saat nanti, tiba-tiba saja kalian jadi korban kezaliman dari orang-orang di luar sana (para kapitalis atau negara-negara superpower) yang mau memaksimalkan daya pikirnya (otak) jauh berlipat-lipat di atas kalian, karena cara kerja dunia ini memang demikian, yang lebih kuat (berpikir) akan memangsa para pemalas. 🤭";=HYPERLINK("https://www.youtube.com/watch?v=fjDhHsKu6fQ&lc=Ugy6UYueo0CiJSttb814AaABAg.AL8Xw8UIVJfAL9s5f9920v","view source")
1328;=HYPERLINK("http://www.youtube.com/@Dropout_str","@Dropout_str");"2025-07-29T13:28:56Z";0;"​​​​​​​​​@AlgoNudger pemalas ?? Gw ngomong panjang lebar yg ada diotak kmu ""pemalas"" ?  Jadi begini sikap org2 yg ngaku super power dan berfikir maju itu, ya ya ya, kami malas, kami b*doh, kami t*lol, Kezaliman negara super power adalah = memaksimalkan daya pikir ? Wow Ngeri manusia ini kembali ke sifat hewan, good keren kalian dewa, kami mah apa atuh bdak. Itu yg mau kamu denger kan  ? 😊";=HYPERLINK("https://www.youtube.com/watch?v=fjDhHsKu6fQ&lc=Ugy6UYueo0CiJSttb814AaABAg.AL8Xw8UIVJfAL9t-om8Hwt","view source")
1329;=HYPERLINK("http://www.youtube.com/@Dropout_str","@Dropout_str");"2025-07-29T13:45:05Z";1;"​​@AlgoNudger aku akan memuskan ego kamu = ""Kamu rajin, kamu pintar, kamu sekolah, itulah sebabnya kamu kaya, kamu perkerja keras, aku aku gamungkin kaya kamu, aku mah malas, dan ga pintar, pokonya aku akan berlindung ke kamu wahai org hebat"".  Pajang lebar gw ngomong di otak lu malah ""pemalas"" huftttt org kaya dari brojol atau okb nih begini sikapnya 😂 ga banyak tapi mayoritasnya";=HYPERLINK("https://www.youtube.com/watch?v=fjDhHsKu6fQ&lc=Ugy6UYueo0CiJSttb814AaABAg.AL8Xw8UIVJfAL9ur3uVPHZ","view source")
1330;=HYPERLINK("http://www.youtube.com/@Dropout_str","@Dropout_str");"2025-07-29T14:09:30Z";1;"​@AlgoNudgerGw dapat pelajaran, secara pisikologis, org yg kaya/okb tidak suka jika org menganggapnya mendapatkan hoki takdir / privilge keluarga. Mereka akan cendrung lebih suka di puji dgn capaian hasil belajar dan kerja krna itu lebih wow dan hebat dimata org lain. Smpai pada akhirnya pemikirannya akan membuat teori yg mendukung egonya, alih2 simpati mereka lebih suka memakai topeng kewibawaan dan kekayaan agar disanjung, dan agar hati nurani-nya tidak berisik otaknya kembali meng-create skenario bahwa ""mereka miskin gagal krena mereka payah & malas, tidak seperti saya""😎  Begitulah cara pikiran dan hatinya bekerja. Sdgkan org2 yg benar kaya dari berjuang akan mendapatkan wibawa tanpa kesombongan dan banyak bicara, effect-nya mereka akan arif dan bijaksana karena mengerti apa maksud dan bagimana artinya ""susah""";=HYPERLINK("https://www.youtube.com/watch?v=fjDhHsKu6fQ&lc=Ugy6UYueo0CiJSttb814AaABAg.AL8Xw8UIVJfAL9xe-ieZDQ","view source")
1331;=HYPERLINK("http://www.youtube.com/@AlgoNudger","@AlgoNudger");"2025-07-29T20:47:01Z";0;"Pantes aja bisa dikibulin oligarki (pemikir keras) dari generasi ke generasi, sementara saudara-saudaranya di gaza mengalami nasib tidak jauh berbeda, dijadikan kelinci percobaan oleh bangsa lain selama berpuluh-puluh tahun. Ternyata memang hobi mereka adalah mempertahankan (menjustifikasi) kemalasan berpikir mereka sendiri. 🤭";=HYPERLINK("https://www.youtube.com/watch?v=fjDhHsKu6fQ&lc=Ugy6UYueo0CiJSttb814AaABAg.AL8Xw8UIVJfALAf8Pa5duH","view source")
1332;=HYPERLINK("http://www.youtube.com/@Dropout_str","@Dropout_str");"2025-07-30T10:18:24Z";0;"​​​​@AlgoNudger mantap, semakin terlihat : sudah pewaris egois pula 😅.  Org kaya lu nih, gw harus ngasih bukti rekening dulu dgn nominal yg jauh lbih besar dari lu, baru lu bisa bilang : iya terima kasih nasihatnya, sya terima sudut pandangnya..   keliatan ko manusia2 yg sikapnya dan telinganya disetir uang 😂";=HYPERLINK("https://www.youtube.com/watch?v=fjDhHsKu6fQ&lc=Ugy6UYueo0CiJSttb814AaABAg.AL8Xw8UIVJfALC7-BtfM-o","view source")
1333;=HYPERLINK("http://www.youtube.com/@Dropout_str","@Dropout_str");"2025-07-30T10:42:18Z";0;"​​​​​​​​​​ nah ini contoh omongan gw. - Hayalan para pewaris - Egonya ingin disanjung dan dianggap hebat, Akalnya menciptakan buah pikiran yg merendahkan 1 pihak dgn sebab yg ia kreasikan sendiri, menutup telinga untuk faktor2 yg lain, intinya akal-nya berusaha agar ""aku ini bukan hoki pwaris tapi pekerja keras, ga ada bapak ku pun aku bisa"" itulah keinginan dilubuk hati-nya yg ingin dipamerkan ke org lain. Krna mereka sadar hal itu gamungkin, maka 1 1nya jalan adalah dengan menghantam org susah itu sendiri = ""kalian pmlas, kalian kurang pintar, kalian kurang berjung, maindset kalian bla bla bla"" yg faktanya pdhl mereka itu lebih berkeringat, tapi tidak seberuntung dia.  Terus ngomong bro, gw bisa bikin buku ini, menganalisa sikap lu 😂";=HYPERLINK("https://www.youtube.com/watch?v=fjDhHsKu6fQ&lc=Ugy6UYueo0CiJSttb814AaABAg.AL8Xw8UIVJfALC9jDQF-Oo","view source")
1334;=HYPERLINK("http://www.youtube.com/@Dropout_str","@Dropout_str");"2025-07-30T10:57:33Z";1;"​@AlgoNudger​​​​​​​​​​ nah ini contoh omongan gw diatas. - Hayalan para pewaris - Egonya ingin disanjung dan dianggap hebat, Akalnya menciptakan buah pikiran yg merendahkan 1 pihak dgn sebab yg ia kreasikan sendiri, menutup telinga untuk faktor2 yg lain, intinya akal-nya berusaha agar ""aku ini bukan hoki pwaris tapi pekerja keras, ga ada bapak ku pun aku bisa"" itulah keinginan dilubuk hati-nya yg ingin dipamerkan ke org lain. Krna mereka sadar hal itu gamungkin, maka 1 1nya jalan adalah dengan menghantam org susah itu sendiri = ""kalian pmlas, kalian kurang pintar, kalian kurang berjung, maindset kalian bla bla bla"" yg faktanya pdhl mereka itu lebih berkeringat, tapi tidak seberuntung dia.  Terus ngomong bro, gw bisa bikin buku ini, menganalisa sikap lu 😂";=HYPERLINK("https://www.youtube.com/watch?v=fjDhHsKu6fQ&lc=Ugy6UYueo0CiJSttb814AaABAg.AL8Xw8UIVJfALCBTvN9kpt","view source")
1335;=HYPERLINK("http://www.youtube.com/@AlgoNudger","@AlgoNudger");"2025-07-30T15:16:46Z";0;"Selamat menikmati buah dari kemalasan *(berpikir* bukan bergerak) kalian. 🤭";=HYPERLINK("https://www.youtube.com/watch?v=fjDhHsKu6fQ&lc=Ugy6UYueo0CiJSttb814AaABAg.AL8Xw8UIVJfALCe8WIcySc","view source")
1336;=HYPERLINK("http://www.youtube.com/@syxxq___0128","@syxxq___0128");"2025-07-29T00:38:56Z";19;"1:28 ""yaudah tapi kamu yg di atas ya"" 😭😭😭😹";=HYPERLINK("https://www.youtube.com/watch?v=fjDhHsKu6fQ&lc=Ugy0ocKUYHoEBdUZeJx4AaABAg","view source")
1337;=HYPERLINK("http://www.youtube.com/@RobiakbarPGSD","@RobiakbarPGSD");"2025-07-29T04:06:22Z";0;"wkwkwk";=HYPERLINK("https://www.youtube.com/watch?v=fjDhHsKu6fQ&lc=Ugy0ocKUYHoEBdUZeJx4AaABAg.AL8VtA-C40oAL8scQcN_jX","view source")
1338;=HYPERLINK("http://www.youtube.com/@saldyhermawan7175","@saldyhermawan7175");"2025-07-29T00:30:45Z";0;"Timothy mnyet😅";=HYPERLINK("https://www.youtube.com/watch?v=fjDhHsKu6fQ&lc=Ugz0mp6Qb0B8mVY_GoV4AaABAg","view source")
1339;=HYPERLINK("http://www.youtube.com/@uripmaiyah","@uripmaiyah");"2025-07-29T00:11:39Z";24;"Ada temen sekolah biasa aja, ga prestasi, ga menonjol akademik. Pendiam ga kreatif, introvert. Terakhir ketemu tetep kaya, mewarisi toko emas keluarganya ... miskin kadang milih2 orang itu aja";=HYPERLINK("https://www.youtube.com/watch?v=fjDhHsKu6fQ&lc=UgwJNyKAJ1YZbJ9Tti14AaABAg","view source")
1340;=HYPERLINK("http://www.youtube.com/@aegis538","@aegis538");"2025-08-10T07:05:29Z";2;"Brarti dia pintar mengelola tokonya dan keuangannya bro. Kalo ga pasti dah bangkrut.";=HYPERLINK("https://www.youtube.com/watch?v=fjDhHsKu6fQ&lc=UgwJNyKAJ1YZbJ9Tti14AaABAg.AL8SlMWCJ1ZALd5epAENSt","view source")
1341;=HYPERLINK("http://www.youtube.com/@exnite511","@exnite511");"2025-08-12T04:39:50Z";6;"​@aegis538iya karena diajarin orang tuanya, orang tuanya juga pinter, coba pemulung😂";=HYPERLINK("https://www.youtube.com/watch?v=fjDhHsKu6fQ&lc=UgwJNyKAJ1YZbJ9Tti14AaABAg.AL8SlMWCJ1ZALhz_owMgk_","view source")
1342;=HYPERLINK("http://www.youtube.com/@aegis538","@aegis538");"2025-08-12T05:32:51Z";4;"​@exnite511ya diajarin mulung lah 😅";=HYPERLINK("https://www.youtube.com/watch?v=fjDhHsKu6fQ&lc=UgwJNyKAJ1YZbJ9Tti14AaABAg.AL8SlMWCJ1ZALi4e8MgAK-","view source")
1343;=HYPERLINK("http://www.youtube.com/@workinghard-07","@workinghard-07");"2025-08-21T09:18:10Z";0;"​​​@aegis538cakeppp, tapi  inget mulung itu keuntungannya gede dong kalo bagi pengepul, kalo pemulungnya yaa segitu gitu aja 😂";=HYPERLINK("https://www.youtube.com/watch?v=fjDhHsKu6fQ&lc=UgwJNyKAJ1YZbJ9Tti14AaABAg.AL8SlMWCJ1ZAM4eaKJR6A2","view source")
1344;=HYPERLINK("http://www.youtube.com/@AdiMulia","@AdiMulia");"2025-07-29T00:10:58Z";1;"Nyampe sini dong 😂";=HYPERLINK("https://www.youtube.com/watch?v=fjDhHsKu6fQ&lc=UgwLPBFjiPjT9JJ1kkZ4AaABAg","view source")
1345;=HYPERLINK("http://www.youtube.com/@fachriamalluddin6353","@fachriamalluddin6353");"2025-07-29T00:07:09Z";0;"Pengikut timothy ronald 😂";=HYPERLINK("https://www.youtube.com/watch?v=fjDhHsKu6fQ&lc=UgyqKpTjUcf7mckzz7B4AaABAg","view source")
1346;=HYPERLINK("http://www.youtube.com/@SONEYEDHIAN","@SONEYEDHIAN");"2025-07-28T23:46:59Z";0;"Asleeee ngakak gara² kata arogan diulang-ulang molo 🤣";=HYPERLINK("https://www.youtube.com/watch?v=fjDhHsKu6fQ&lc=UgxieBo6bfjWNmA9vT54AaABAg","view source")
1347;=HYPERLINK("http://www.youtube.com/@erikarmado3579","@erikarmado3579");"2025-07-28T23:01:00Z";0;"Tolong segerakanlah kemenangan untuk Palestina ya Allah😢";=HYPERLINK("https://www.youtube.com/watch?v=fjDhHsKu6fQ&lc=UgyV5lScHKejSHI-8tp4AaABAg","view source")
1348;=HYPERLINK("http://www.youtube.com/@minotour78940","@minotour78940");"2025-07-28T22:32:33Z";0;"Yang aneh itu dari Timothy Ronald , meskipun dia kaya , dia buka kelas berbayar";=HYPERLINK("https://www.youtube.com/watch?v=fjDhHsKu6fQ&lc=Ugwp4h7_yqBO-KQTeKt4AaABAg","view source")
1349;=HYPERLINK("http://www.youtube.com/@adelpuspita5508","@adelpuspita5508");"2025-07-29T01:36:21Z";0;"Gua smenjak kasus penipuan berkedok investasi bodong ,,ga akan pernah percaya org semcam kayak timoty ini,takutnya motivator penipuan juga ...ga salah antimage pernah ketipu beliau juga kan...😂";=HYPERLINK("https://www.youtube.com/watch?v=fjDhHsKu6fQ&lc=Ugwp4h7_yqBO-KQTeKt4AaABAg.AL8HQTwfofDAL8bSkd3XuK","view source")
1350;=HYPERLINK("http://www.youtube.com/@kangmintaid3970","@kangmintaid3970");"2025-07-28T21:42:16Z";0;"Sebenarnya yang ditegur Timothy itu bukan orang yang miskin yang makan besok aja susah, tapi yang punya fasilitas (keluarga sederhana)  dan tenaga, wong dia aja bilang orang orang yang punya mobil masih miskin  Keknya di Timothy itu rank nya mulai dari  Orang susah Orang miskin Orang kaya";=HYPERLINK("https://www.youtube.com/watch?v=fjDhHsKu6fQ&lc=Ugyt7bbpK-PQZqesLHh4AaABAg","view source")
1351;=HYPERLINK("http://www.youtube.com/@HendraJoko-o6u","@HendraJoko-o6u");"2025-07-30T06:40:00Z";0;"Nah ini muncul satu 😂";=HYPERLINK("https://www.youtube.com/watch?v=fjDhHsKu6fQ&lc=Ugyt7bbpK-PQZqesLHh4AaABAg.AL8BfBpb5ZTALBj-UYJRuQ","view source")
1352;=HYPERLINK("http://www.youtube.com/@rivankrisnamaulana778","@rivankrisnamaulana778");"2025-07-30T09:16:49Z";0;"@HendraJoko-o6usudah masuk kelas online nya mungkin";=HYPERLINK("https://www.youtube.com/watch?v=fjDhHsKu6fQ&lc=Ugyt7bbpK-PQZqesLHh4AaABAg.AL8BfBpb5ZTALC-x7C-3Hc","view source")
1353;=HYPERLINK("http://www.youtube.com/@rafly583","@rafly583");"2025-07-28T20:43:10Z";0;"Ronald m3m3k";=HYPERLINK("https://www.youtube.com/watch?v=fjDhHsKu6fQ&lc=UgwdWUNOzILAtM6hw1x4AaABAg","view source")
1354;=HYPERLINK("http://www.youtube.com/@masterjejep1386","@masterjejep1386");"2025-07-28T19:47:38Z";0;"Tai cuma 3 menit doang bikin lagi yg banyak";=HYPERLINK("https://www.youtube.com/watch?v=fjDhHsKu6fQ&lc=UgxTq1BiM1kEh_RLHUt4AaABAg","view source")
1355;=HYPERLINK("http://www.youtube.com/@abemwhy","@abemwhy");"2025-07-28T19:34:17Z";0;"TMT kntl";=HYPERLINK("https://www.youtube.com/watch?v=fjDhHsKu6fQ&lc=UgyYTDzKxRMINmwOqwh4AaABAg","view source")
1356;=HYPERLINK("http://www.youtube.com/@fatihainulyaqin","@fatihainulyaqin");"2025-07-28T18:47:01Z";1;"Wkowkowko";=HYPERLINK("https://www.youtube.com/watch?v=fjDhHsKu6fQ&lc=UgyKqouPClFcJbIbCtN4AaABAg","view source")
1357;=HYPERLINK("http://www.youtube.com/@jayagraha9109","@jayagraha9109");"2025-07-28T17:47:32Z";0;"Tinggal buat parodi motivator perintis cilik";=HYPERLINK("https://www.youtube.com/watch?v=fjDhHsKu6fQ&lc=Ugw540l_YGN_6545z2p4AaABAg","view source")
1358;=HYPERLINK("http://www.youtube.com/@insanalfarabi","@insanalfarabi");"2025-07-28T17:14:07Z";0;"Bang coba buat konten pewaris sama perintis pasti bagus tuh bang😂";=HYPERLINK("https://www.youtube.com/watch?v=fjDhHsKu6fQ&lc=UgwhWi1TyxZeCpwflZ94AaABAg","view source")
1359;=HYPERLINK("http://www.youtube.com/@Ingengerdwasright-88","@Ingengerdwasright-88");"2025-07-28T15:57:22Z";1;"Beliau belum tau bagaimana rasanya kerja keras tapi bos bayar gajian suka telat ke karyawan. 😂 Gak China, gak Pribumi, gak Arab, di Indonesia emang udah gak waras tai 😂😂";=HYPERLINK("https://www.youtube.com/watch?v=fjDhHsKu6fQ&lc=Ugxx2g53SHVUAywZU8p4AaABAg","view source")
1360;=HYPERLINK("http://www.youtube.com/@riovidyatmaka","@riovidyatmaka");"2025-07-28T15:07:42Z";0;"Tumben ga 8 menit wkwk";=HYPERLINK("https://www.youtube.com/watch?v=fjDhHsKu6fQ&lc=UgwEmr2CTVGbuX-1zfh4AaABAg","view source")
1361;=HYPERLINK("http://www.youtube.com/@Bokir_603","@Bokir_603");"2025-07-28T14:45:34Z";0;"Tae bebek";=HYPERLINK("https://www.youtube.com/watch?v=fjDhHsKu6fQ&lc=UgxtBr1QgT5d7SvFPBF4AaABAg","view source")
1362;=HYPERLINK("http://www.youtube.com/@erinaUntari","@erinaUntari");"2025-07-28T14:26:28Z";195;"jangan lupa bang KOBE4D akan ada bagi bagi bonus Gratis sepesial memperingati hari kemerdekaan indonesia  segera join dan claim bonus nya mulai 1 agustus hingga 31 agustus";=HYPERLINK("https://www.youtube.com/watch?v=fjDhHsKu6fQ&lc=Ugx8jcLtV8VXfeYGt6p4AaABAg","view source")
1363;=HYPERLINK("http://www.youtube.com/@fikrinaufalalkampary1755","@fikrinaufalalkampary1755");"2025-07-28T12:36:25Z";0;"Irul mendalami jiwa tiap syuting😂😂";=HYPERLINK("https://www.youtube.com/watch?v=fjDhHsKu6fQ&lc=Ugzmct50WI5eI2zm61x4AaABAg","view source")
1364;=HYPERLINK("http://www.youtube.com/@JDtrain1","@JDtrain1");"2025-07-28T12:34:45Z";220;"Saran dia banyak yang absurd karena dia copy paste influencer finansial luar negeri, jadi gak nyambung dengan situasi di Indonesia 😂";=HYPERLINK("https://www.youtube.com/watch?v=fjDhHsKu6fQ&lc=UgxdgGwpxY1o18EG0VZ4AaABAg","view source")
1365;=HYPERLINK("http://www.youtube.com/@arrrararrrarraarar","@arrrararrrarraarar");"2025-07-28T19:14:37Z";49;"Kebanyakan penyepongnya gak tau bang, mereka kira dia sebijak itu. Standar iq 85 ke bawah memang mudah sih untuk di convert jadi pengikut 😂";=HYPERLINK("https://www.youtube.com/watch?v=fjDhHsKu6fQ&lc=UgxdgGwpxY1o18EG0VZ4AaABAg.AL7D08Yc9etAL7vlr_nNrP","view source")
